title,content,author,category,published_date,featured_image,tags,status
Getting Started with React,Learn the basics of React development including components and state management,John Developer,Technology,2024-01-15,https://images.unsplash.com/photo-1633356122544-f134324a6cee,"react, javascript, tutorial",Published
UI Design Best Practices,Essential principles for creating user-friendly interfaces,Jane Designer,Design,2024-01-20,https://images.unsplash.com/photo-1586717791821-3f44a563fa4c,"design, UI, best practices",Published
Marketing Strategies for 2024,Top marketing trends and strategies for the upcoming year,Bob Marketer,Marketing,2024-01-25,https://images.unsplash.com/photo-1460925895917-afdab827c52f,"marketing, strategy, trends",Draft
SEO Optimization Guide,Complete guide to search engine optimization for modern websites,Alice Writer,SEO,2024-01-30,https://images.unsplash.com/photo-1562577309-4932fdd64cd1,"SEO, optimization, guide",Published
Team Collaboration Tools,Review of the best tools for remote team collaboration,Charlie Manager,Productivity,2024-02-05,https://images.unsplash.com/photo-1552664730-d307ca884978,"collaboration, tools, remote",Published